filename;jobid;uid;runtime;start_time;end_time;exec;file;interval-id;start;end;info;X1_access_count;X1_access_size;read_bytes;write_bytes
11.parsed.json;45;41;748;3761;4508;21;"1.7";1;2.3;49.8;posix read unique file;4;4;14;0
11.parsed.json;45;41;220;3761;4508;21;"1.5";2;696.5;747.4;posix write consecutive sequential unique file;4;4;0;14
11.parsed.json;45;41;500;3761;4508;21;"1.5";2;696.5;747.4;posix read consecutive sequential unique file;4;4;0;14
12.parsed.json;13;41;3578;3777;8354;15;"1.0";1;2.7;37.2;posix write unique file;4;4;20;0
12.parsed.json;45;41;1000;3777;8354;21;"1.5";2;120.0;747.4;posix write sequential unique file;4;4;0;14
13.parsed.json;45;41;500;4470;4508;21;"1.5";2;1.5;47.4;posix write   unique file;4;4;0;14
14.parsed.json;45;41;500;4508;4508;21;"1.5";2;6.5;47.4;posix read consecutive sequential unique file;4;4;0;14
