filename;start_time;end_time;start;end;info
11.parsed.json;3761;4508;2.3;49.8;posix read unique file
11.parsed.json;3761;4508;696.5;747.4;posix write consecutive sequential unique file
11.parsed.json;3761;4508;696.5;747.4;posix read consecutive sequential unique file
12.parsed.json;3777;8354;2.7;37.2;posix write unique file
12.parsed.json;3777;8354;120.0;747.4;posix write sequential unique file
13.parsed.json;4470;4508;1.5;47.4;posix write unique file
14.parsed.json;4508;4508;6.5;47.4;posix read consecutive sequential unique file